news_title,news_source,news_date,news_link,bulo_title,bulo_source,bulo_link,similarity,risk_score,detected_at
El gran treball de l'arquebisbe,levante_emv,2026-03-10 14:35:02,https://www.levante-emv.com/lectores/2026/03/10/gran-treball-larquebisbe-127786837.html,"No, el Gran Wyoming no se enfadó y gritó a una becaria durante una grabación de El Intermedio: fue una broma para Intereconomía",maldita,https://maldita.es/malditobulo/20260311/el-gran-wyoming-se-enfada-y-grita-a-una-becaria-que-entra-en-plato-cuando-esta-ensayando-el-programa/,0.433,86,2026-03-13 09:15
“Nací con un gran cabezón”,lavanguardia,2026-03-08 05:00:00,https://www.lavanguardia.com/lacontra/20260308/11483100/naci-gran-cabezon.html,"No, el Gran Wyoming no se enfadó y gritó a una becaria durante una grabación de El Intermedio: fue una broma para Intereconomía",maldita,https://maldita.es/malditobulo/20260311/el-gran-wyoming-se-enfada-y-grita-a-una-becaria-que-entra-en-plato-cuando-esta-ensayando-el-programa/,0.433,86,2026-03-13 09:15
La gente en la inteligencia artificial (II),lavanguardia,2026-03-06 23:30:00,https://www.lavanguardia.com/opinion/20260307/11482984/gente-inteligencia-artificial-ii.html,"No, esta imagen de soldados estadounidenses detenidos por Irán no es real: está generada con inteligencia artificial",maldita,https://maldita.es/malditobulo/20260310/imagen-muestra-soldados-estadounidenses-detenidos-en-iran/,0.422,84,2026-03-13 09:15
La Universitat de Barcelona se convierte en socia académica destacada del Banco de España,lavanguardia,2026-03-11 09:42:57,https://www.lavanguardia.com/launi/20260311/11486912/universitat-barcelona-convierte-socia-academica-destacada-banco-espana.html,El Banco de España no ha cambiado ninguna norma sobre el impuesto de sucesiones,newtral,https://www.newtral.es/bulo-banco-espana-impuesto-sucesiones/20260312/,0.411,82,2026-03-13 09:15
Inteligencia artificial para ayudar a ganar la guerra,expansion,2026-03-12 00:08:03,https://www.expansion.com/economia-digital/companias/2026/03/12/69b1a177468aebf1778b45db.html,"No, esta imagen de soldados estadounidenses detenidos por Irán no es real: está generada con inteligencia artificial",maldita,https://maldita.es/malditobulo/20260310/imagen-muestra-soldados-estadounidenses-detenidos-en-iran/,0.41,81,2026-03-13 09:15
"De Angrisano a Ayuso, pasando por Núñez y Fanjul",eldiario,2026-03-09 21:02:13,https://www.eldiario.es/opinion/zona-critica/angrisano-ayuso-pasando-nunez-fanjul_129_13053298.html,"No, Ayuso no habla en este vídeo de trenes ni Puente responde “los trenes puede que lleguen tarde, pero el retraso lo tiene Ayuso”: es un “montaje”",maldita,https://maldita.es/malditobulo/20260311/oscar-puente-responde-a-ayuso-los-trenes-pueden-llegar-tarde-pero-el-retraso-lo-tiene-ella/,0.405,80,2026-03-13 09:15
Estados Unidos exhibe poder militar con un nuevo vídeo,levante_emv,2026-03-10 17:51:31,https://www.levante-emv.com/videos/internacional/2026/03/10/estados-unidos-exhibe-militar-nuevo-video-127797603.html,Este vídeo de barcos de guerra de Estados Unidos supuestamente entrando por Ayamonte (Huelva) está manipulado con IA,newtral,https://www.newtral.es/barcos-guerra-ayamonte/20260312/,0.404,80,2026-03-13 09:15
"Estados Unidos, el gran perdedor",lavanguardia,2026-03-07 23:09:18,https://www.lavanguardia.com/opinion/20260308/11483913/estados-unidos-gran-perdedor.html,Este vídeo de barcos de guerra de Estados Unidos supuestamente entrando por Ayamonte (Huelva) está manipulado con IA,newtral,https://www.newtral.es/barcos-guerra-ayamonte/20260312/,0.404,80,2026-03-13 09:15
