news_title,news_source,news_date,news_link,bulo_title,bulo_source,bulo_link,similarity,risk_score,detected_at
Ataques contra la risa,heraldo_aragon,2026-03-11 04:00:00,https://www.heraldo.es/noticias/opinion/2026/03/11/ataques-contra-la-risa-1901160.html,Esta manifestación en Madrid no es para pedir el fin de los ataques contra Irán y tampoco es actual,newtral,https://www.newtral.es/manifestacion-madrid-iran/20260311/,0.453,90,2026-03-12 08:31
El gran treball de l'arquebisbe,levante_emv,2026-03-10 14:35:02,https://www.levante-emv.com/lectores/2026/03/10/gran-treball-larquebisbe-127786837.html,"No, el Gran Wyoming no se enfadó y gritó a una becaria durante una grabación de El Intermedio: fue una broma para Intereconomía",maldita,https://maldita.es/malditobulo/20260311/el-gran-wyoming-se-enfada-y-grita-a-una-becaria-que-entra-en-plato-cuando-esta-ensayando-el-programa/,0.433,86,2026-03-12 08:31
"Eneko Atxa, la madurez conceptual y estética de un gran cocinero",elcorreo,2026-03-09 18:46:04,https://www.elcorreo.com/jantour/restaurantes/eneko-atxa-madurez-conceptual-estetica-gran-cocinero-20260307194538-nt.html,"No, el Gran Wyoming no se enfadó y gritó a una becaria durante una grabación de El Intermedio: fue una broma para Intereconomía",maldita,https://maldita.es/malditobulo/20260311/el-gran-wyoming-se-enfada-y-grita-a-una-becaria-que-entra-en-plato-cuando-esta-ensayando-el-programa/,0.433,86,2026-03-12 08:31
“Nací con un gran cabezón”,lavanguardia,2026-03-08 05:00:00,https://www.lavanguardia.com/lacontra/20260308/11483100/naci-gran-cabezon.html,"No, el Gran Wyoming no se enfadó y gritó a una becaria durante una grabación de El Intermedio: fue una broma para Intereconomía",maldita,https://maldita.es/malditobulo/20260311/el-gran-wyoming-se-enfada-y-grita-a-una-becaria-que-entra-en-plato-cuando-esta-ensayando-el-programa/,0.433,86,2026-03-12 08:31
La gente en la inteligencia artificial (II),lavanguardia,2026-03-06 23:30:00,https://www.lavanguardia.com/opinion/20260307/11482984/gente-inteligencia-artificial-ii.html,"No, este vídeo de dos barcos con bandera estadounidense entrando en el puerto de Ayamonte (Huelva) no es real: están generados con inteligencia artificial",maldita,https://maldita.es/malditobulo/20260311/dos-buques-con-bandera-estadounidense-llegan-al-puerto-de-ayamonte-huelva/,0.402,80,2026-03-12 08:31
