news_title,news_source,news_date,news_link,bulo_title,bulo_source,bulo_link,similarity,risk_score,detected_at
La Armada Vencible de Reino Unido,lavanguardia,2026-03-11 05:00:00,https://www.lavanguardia.com/internacional/20260311/11486493/armada-vencible.html,Los musulmanes en Reino Unido no están pidiendo “barrios libres de perros”,newtral,https://www.newtral.es/musulmanes-reino-unido-perros-fake/20260313/,0.59,100,2026-03-13 13:31
Zurich compra a Generali España sus filiales en Irlanda y Reino Unido por 337 millones,expansion,2026-03-10 00:58:17,https://www.expansion.com/empresas/seguros/2026/03/10/69af3b61468aebaf2c8b4578.html,Los musulmanes en Reino Unido no están pidiendo “barrios libres de perros”,newtral,https://www.newtral.es/musulmanes-reino-unido-perros-fake/20260313/,0.546,100,2026-03-13 13:31
"La policía de Reino Unido, en guardia por las peleas de instituto",heraldo_aragon,2026-03-08 04:00:00,https://www.heraldo.es/noticias/internacional/2026/03/08/la-policia-de-reino-unido-en-guardia-por-las-peleas-de-instituto-1900347.html,Los musulmanes en Reino Unido no están pidiendo “barrios libres de perros”,newtral,https://www.newtral.es/musulmanes-reino-unido-perros-fake/20260313/,0.511,100,2026-03-13 13:31
Matan en la cárcel a uno de los asesinos más notorios del Reino Unido,lavanguardia,2026-03-07 11:51:54,https://www.lavanguardia.com/sucesos/20260307/11483849/matan-carcel-asesinos-mas-notorios-reino-unido.html,Los musulmanes en Reino Unido no están pidiendo “barrios libres de perros”,newtral,https://www.newtral.es/musulmanes-reino-unido-perros-fake/20260313/,0.488,97,2026-03-13 13:31
Completa tu FP con un grado universitario en Reino Unido,heraldo_aragon,2026-03-13 04:00:00,https://www.heraldo.es/branded/completa-tu-fp-con-un-grado-universitario-en-reino-unido/,Los musulmanes en Reino Unido no están pidiendo “barrios libres de perros”,newtral,https://www.newtral.es/musulmanes-reino-unido-perros-fake/20260313/,0.487,97,2026-03-13 13:31
Revolut logra la licencia bancaria completa en Reino Unido,expansion,2026-03-11 15:07:55,https://www.expansion.com/empresas/banca/2026/03/11/69b184c2e5fdea2e038b45c5.html,Los musulmanes en Reino Unido no están pidiendo “barrios libres de perros”,newtral,https://www.newtral.es/musulmanes-reino-unido-perros-fake/20260313/,0.472,94,2026-03-13 13:31
Santander y TSB suben hipotecas en Reino Unido al calor de la guerra de Irán,expansion,2026-03-11 17:53:58,https://www.expansion.com/mercados/2026/03/11/69b1aa46e5fdeacb368b459a.html,Los musulmanes en Reino Unido no están pidiendo “barrios libres de perros”,newtral,https://www.newtral.es/musulmanes-reino-unido-perros-fake/20260313/,0.46,91,2026-03-13 13:31
Los fondos ya pueden embargar bienes de España en Reino Unido por los impagos a las renovables,okdiario,2026-03-09 04:45:49,https://okdiario.com/economia/fondos-ya-pueden-embargar-bienes-espana-reino-unido-impagos-renovables-16369243,Los musulmanes en Reino Unido no están pidiendo “barrios libres de perros”,newtral,https://www.newtral.es/musulmanes-reino-unido-perros-fake/20260313/,0.459,91,2026-03-13 13:31
El Reino Unido ofrecerá hasta 46.000 euros a los solicitantes de asilo rechazados para que abandonen el país,lavanguardia,2026-03-06 09:19:32,https://www.lavanguardia.com/internacional/20260306/11482832/reino-unido-ofrecera-46-000-euros-solicitantes-asilo-rechazados-abandonen-pais.html,Los musulmanes en Reino Unido no están pidiendo “barrios libres de perros”,newtral,https://www.newtral.es/musulmanes-reino-unido-perros-fake/20260313/,0.456,91,2026-03-13 13:31
Documentos revelan que Reino Unido sabía del riesgo al nombrar a Mandelson por vínculos con Epstein,france24_es,2026-03-12 02:46:46,https://www.france24.com/es/video/20260312-documentos-revelan-que-reino-unido-sab%C3%ADa-del-riesgo-al-nombrar-a-mandelson-por-v%C3%ADnculos-con-epstein,Los musulmanes en Reino Unido no están pidiendo “barrios libres de perros”,newtral,https://www.newtral.es/musulmanes-reino-unido-perros-fake/20260313/,0.451,90,2026-03-13 13:31
"La Armada Vencible: el poder militar del Reino Unido, en horas bajas",lavanguardia,2026-03-11 05:00:00,https://www.lavanguardia.com/internacional/20260311/11486493/armada-vencible.html,Los musulmanes en Reino Unido no están pidiendo “barrios libres de perros”,newtral,https://www.newtral.es/musulmanes-reino-unido-perros-fake/20260313/,0.438,87,2026-03-13 13:31
“Nací con un gran cabezón”,lavanguardia,2026-03-08 05:00:00,https://www.lavanguardia.com/lacontra/20260308/11483100/naci-gran-cabezon.html,"No, el Gran Wyoming no se enfadó y gritó a una becaria durante una grabación de El Intermedio: fue una broma para Intereconomía",maldita,https://maldita.es/malditobulo/20260311/el-gran-wyoming-se-enfada-y-grita-a-una-becaria-que-entra-en-plato-cuando-esta-ensayando-el-programa/,0.433,86,2026-03-13 13:31
El gran treball de l'arquebisbe,levante_emv,2026-03-10 14:35:02,https://www.levante-emv.com/lectores/2026/03/10/gran-treball-larquebisbe-127786837.html,"No, el Gran Wyoming no se enfadó y gritó a una becaria durante una grabación de El Intermedio: fue una broma para Intereconomía",maldita,https://maldita.es/malditobulo/20260311/el-gran-wyoming-se-enfada-y-grita-a-una-becaria-que-entra-en-plato-cuando-esta-ensayando-el-programa/,0.433,86,2026-03-13 13:31
Irán coloca en su diana a la infraestructura de inteligencia artificial de los países del Golfo,elpais,2026-03-13 04:45:01,https://elpais.com/internacional/2026-03-13/iran-coloca-en-su-diana-a-la-infraestructura-de-inteligencia-artificial-de-los-paises-del-golfo.html,"No, esta imagen de soldados estadounidenses detenidos por Irán no es real: está generada con inteligencia artificial",maldita,https://maldita.es/malditobulo/20260310/imagen-muestra-soldados-estadounidenses-detenidos-en-iran/,0.423,84,2026-03-13 13:31
El Reino Unido presiona a las tecnológicas para que actúen contra la propagación de información falsa en las redes sociales,levante_emv,2026-03-09 19:11:30,https://www.levante-emv.com/internacional/2026/03/09/reino-unido-presiona-tecnologicas-actuen-propagacion-informacion-falsa-redes-sociales-127755173.html,Los musulmanes en Reino Unido no están pidiendo “barrios libres de perros”,newtral,https://www.newtral.es/musulmanes-reino-unido-perros-fake/20260313/,0.42,83,2026-03-13 13:31
La gente en la inteligencia artificial (II),lavanguardia,2026-03-06 23:30:00,https://www.lavanguardia.com/opinion/20260307/11482984/gente-inteligencia-artificial-ii.html,"No, esta imagen de soldados estadounidenses detenidos por Irán no es real: está generada con inteligencia artificial",maldita,https://maldita.es/malditobulo/20260310/imagen-muestra-soldados-estadounidenses-detenidos-en-iran/,0.42,83,2026-03-13 13:31
El Gobierno aviva el choque con Israel: cesa a la embajadora en Tel Aviv y no contempla nombrar un sustituto,20minutos,2026-03-11 11:09:34,https://www.20minutos.es/nacional/gobierno-cesa-embajadora-israel-llamada-consultas-septiembre-tras-ultimo-choque-con-ejecutivo-netanyahu_6944644_0.html,"No, este vídeo no es de ataques de Irán a Tel Aviv (Israel) en marzo de 2026: ya se difundía en 2025",maldita,https://maldita.es/malditobulo/20260311/video-del-ataque-con-misiles-de-iran-a-tel-aviv/,0.418,83,2026-03-13 13:31
Revolut lanza su banco en Reino Unido tras cuatro años de negociaciones,levante_emv,2026-03-11 14:16:13,https://www.levante-emv.com/economia/2026/03/11/revolut-lanza-banco-reino-unido-127834012.html,Los musulmanes en Reino Unido no están pidiendo “barrios libres de perros”,newtral,https://www.newtral.es/musulmanes-reino-unido-perros-fake/20260313/,0.418,83,2026-03-13 13:31
Los “expats” en los Emiratos por razones fiscales no dan pena en el Reino Unido,lavanguardia,2026-03-09 05:00:00,https://www.lavanguardia.com/internacional/20260309/11484575/expats-viven-emiratos-razones-fiscales-inspiran-pena-reino-unido.html,Los musulmanes en Reino Unido no están pidiendo “barrios libres de perros”,newtral,https://www.newtral.es/musulmanes-reino-unido-perros-fake/20260313/,0.416,83,2026-03-13 13:31
La UE y Reino Unido advierten a los buques del riesgo extremo de cruzar el estrecho de Ormuz,elpais,2026-03-12 04:25:00,https://cincodias.elpais.com/mercados-financieros/2026-03-12/la-ue-y-reino-unido-advierten-a-los-buques-del-riesgo-extremo-de-cruzar-el-estrecho-de-ormuz.html,Los musulmanes en Reino Unido no están pidiendo “barrios libres de perros”,newtral,https://www.newtral.es/musulmanes-reino-unido-perros-fake/20260313/,0.415,82,2026-03-13 13:31
Un incendio cerca de la estación central de Glasgow provoca interrupciones en los trenes de Reino Unido,elmundo_internacional,2026-03-09 07:58:57,https://www.elmundo.es/internacional/2026/03/09/69ae7d4ee85ece2e268b4573.html,Los musulmanes en Reino Unido no están pidiendo “barrios libres de perros”,newtral,https://www.newtral.es/musulmanes-reino-unido-perros-fake/20260313/,0.413,82,2026-03-13 13:31
Los “expats” que viven en los Emiratos por razones fiscales no inspiran pena en el Reino Unido,lavanguardia,2026-03-09 05:00:00,https://www.lavanguardia.com/internacional/20260309/11484575/expats-viven-emiratos-razones-fiscales-inspiran-pena-reino-unido.html,Los musulmanes en Reino Unido no están pidiendo “barrios libres de perros”,newtral,https://www.newtral.es/musulmanes-reino-unido-perros-fake/20260313/,0.411,82,2026-03-13 13:31
Inteligencia artificial para ayudar a ganar la guerra,expansion,2026-03-12 00:08:03,https://www.expansion.com/economia-digital/companias/2026/03/12/69b1a177468aebf1778b45db.html,"No, esta imagen de soldados estadounidenses detenidos por Irán no es real: está generada con inteligencia artificial",maldita,https://maldita.es/malditobulo/20260310/imagen-muestra-soldados-estadounidenses-detenidos-en-iran/,0.408,81,2026-03-13 13:31
Rusia acusa al Reino Unido de cooperar con Ucrania en el bombardeo de una fábrica de armamento,elpais,2026-03-11 10:43:07,https://elpais.com/internacional/2026-03-11/rusia-acusa-al-reino-unido-de-cooperar-con-kiev-en-el-bombardeo-de-una-fabrica-de-armamento.html,Los musulmanes en Reino Unido no están pidiendo “barrios libres de perros”,newtral,https://www.newtral.es/musulmanes-reino-unido-perros-fake/20260313/,0.405,81,2026-03-13 13:31
Reino Unido asegura que el dron que alcanzó su base en Chipre se lanzó desde Líbano,20minutos,2026-03-07 16:27:11,https://www.20minutos.es/internacional/reino-unido-dice-que-dron-que-alcanzo-base-britanica-chipre-se-lanzo-desde-libano_6943170_0.html,Los musulmanes en Reino Unido no están pidiendo “barrios libres de perros”,newtral,https://www.newtral.es/musulmanes-reino-unido-perros-fake/20260313/,0.404,80,2026-03-13 13:31
Estados Unidos exhibe poder militar con un nuevo vídeo,levante_emv,2026-03-10 17:51:31,https://www.levante-emv.com/videos/internacional/2026/03/10/estados-unidos-exhibe-militar-nuevo-video-127797603.html,Este vídeo de barcos de guerra de Estados Unidos supuestamente entrando por Ayamonte (Huelva) está manipulado con IA,newtral,https://www.newtral.es/barcos-guerra-ayamonte/20260312/,0.403,80,2026-03-13 13:31
"Estados Unidos, el gran perdedor",lavanguardia,2026-03-07 23:09:18,https://www.lavanguardia.com/opinion/20260308/11483913/estados-unidos-gran-perdedor.html,Este vídeo de barcos de guerra de Estados Unidos supuestamente entrando por Ayamonte (Huelva) está manipulado con IA,newtral,https://www.newtral.es/barcos-guerra-ayamonte/20260312/,0.402,80,2026-03-13 13:31
