news_title,news_source,news_date,news_link,bulo_title,bulo_source,bulo_link,similarity,risk_score,detected_at
La Universitat de Barcelona se convierte en socia académica destacada del Banco de España,lavanguardia,2026-03-11 09:42:57,https://www.lavanguardia.com/launi/20260311/11486912/universitat-barcelona-convierte-socia-academica-destacada-banco-espana.html,El Banco de España no ha cambiado ninguna norma sobre el impuesto de sucesiones,newtral,https://www.newtral.es/bulo-banco-espana-impuesto-sucesiones/20260312/,0.443,88,2026-03-13 06:31
El gran treball de l'arquebisbe,levante_emv,2026-03-10 14:35:02,https://www.levante-emv.com/lectores/2026/03/10/gran-treball-larquebisbe-127786837.html,"No, el Gran Wyoming no se enfadó y gritó a una becaria durante una grabación de El Intermedio: fue una broma para Intereconomía",maldita,https://maldita.es/malditobulo/20260311/el-gran-wyoming-se-enfada-y-grita-a-una-becaria-que-entra-en-plato-cuando-esta-ensayando-el-programa/,0.434,86,2026-03-13 06:31
“Nací con un gran cabezón”,lavanguardia,2026-03-08 05:00:00,https://www.lavanguardia.com/lacontra/20260308/11483100/naci-gran-cabezon.html,"No, el Gran Wyoming no se enfadó y gritó a una becaria durante una grabación de El Intermedio: fue una broma para Intereconomía",maldita,https://maldita.es/malditobulo/20260311/el-gran-wyoming-se-enfada-y-grita-a-una-becaria-que-entra-en-plato-cuando-esta-ensayando-el-programa/,0.434,86,2026-03-13 06:31
El Gobierno aviva el choque con Israel: cesa a la embajadora en Tel Aviv y no contempla nombrar un sustituto,20minutos,2026-03-11 11:09:34,https://www.20minutos.es/nacional/gobierno-cesa-embajadora-israel-llamada-consultas-septiembre-tras-ultimo-choque-con-ejecutivo-netanyahu_6944644_0.html,"No, este vídeo no es de ataques de Irán a Tel Aviv (Israel) en marzo de 2026: ya se difundía en 2025",maldita,https://maldita.es/malditobulo/20260311/video-del-ataque-con-misiles-de-iran-a-tel-aviv/,0.418,83,2026-03-13 06:31
"Estados Unidos, el gran perdedor",lavanguardia,2026-03-07 23:09:18,https://www.lavanguardia.com/opinion/20260308/11483913/estados-unidos-gran-perdedor.html,Este vídeo de barcos de guerra de Estados Unidos supuestamente entrando por Ayamonte (Huelva) está manipulado con IA,newtral,https://www.newtral.es/barcos-guerra-ayamonte/20260312/,0.405,80,2026-03-13 06:31
Estados Unidos exhibe poder militar con un nuevo vídeo,levante_emv,2026-03-10 17:51:31,https://www.levante-emv.com/videos/internacional/2026/03/10/estados-unidos-exhibe-militar-nuevo-video-127797603.html,Este vídeo de barcos de guerra de Estados Unidos supuestamente entrando por Ayamonte (Huelva) está manipulado con IA,newtral,https://www.newtral.es/barcos-guerra-ayamonte/20260312/,0.404,80,2026-03-13 06:31
