ccaa,code,mentions,top_sources,top_titles,last_update
Aragón,ES-AR,349,"{'heraldo_aragon': 314, 'okdiario': 7, 'eldiario': 6}",Descubren más de un centenar de fósiles de reptil volador del Jurásico en Teruel | El CSIC en Aragón conmemora el Día de la Mujer con una jornada sobre la igualdad | The Champions Burger regresa a Zaragoza: estas son las hamburgueserías que estarán y las fechas,2026-03-09 22:32
Madrid,ES-MD,312,"{'20minutos': 59, 'google_news_es': 41, 'okdiario': 32}",Detenidos diez neonazis de Núcleo Nacional por provocar altercados en la manifestación del 8-M en Madrid | Atlético de Madrid – Tottenham: horario y canal de televisión para ver en directo y en streaming los octavos de la Champions League | Milei viaja esta semana a España para volver a participar en el Madrid Economic Forum,2026-03-09 22:32
Cataluña,ES-CT,167,"{'lavanguardia': 46, 'okdiario': 25, 'elpais': 19}",Alineación posible del Barcelona contra el Newcastle: Pedri será titular | Cuándo es el Newcastle – Barcelona: a qué hora empieza y dónde ver el partido de octavos de final de la Champions League | El despacho Blas de Lezo compra 190m2 de oficinas a Inbisa en un punto estratégico de Barcelona,2026-03-09 22:32
Andalucía,ES-AN,165,"{'google_news_es': 50, 'okdiario': 20, 'heraldo_aragon': 13}",La explosión de una granada en una discoteca de Perú evidencia el poder de las mafias | Dimite la concejal de Igualdad de un pueblo de Granada tras ser condenada por agredir a una vecina | El Cádiz trabaja «a contrarreloj» para el choque con el Mirandés,2026-03-09 22:32
Comunidad Valenciana,ES-VC,143,"{'levante_emv': 40, 'okdiario': 17, 'google_news_es': 15}",Centro de Arte Hortensia Herrero. La joya escondida de Valencia | El Ayuntamiento de Alicante aparta del Plan General al arquitecto con una vivienda protegida en Les Naus | Residencial Les Naus de Alicante,2026-03-09 22:32
Castilla y León,ES-CL,127,"{'google_news_es': 18, 'okdiario': 17, 'levante_emv': 14}",León XIV eleva el tono ante la guerra de Trump y Netanyahu | Feijóo dice que Vox estafa a sus votantes y busca el bloqueo en Castilla y León | Feijóo augura que Vox “bloqueará” también Castilla y León “por las elecciones andaluzas”,2026-03-09 22:32
País Vasco,ES-PV,71,"{'elcorreo': 51, 'google_news_es': 5, 'okdiario': 4}","El gigante Hithium, que tiene un acuerdo con Euskadi, estudia una inversión de 400 millones en Navarra | La Policía acude a un partido de cadetes en Vitoria con seis expulsados y amenazas al árbitro | El Surne Bilbao hace un llamamiento a la marea negra para grabar el vídeo del himno oficial del club",2026-03-09 22:32
Baleares,ES-IB,70,"{'okdiario': 30, 'google_news_es': 11, 'levante_emv': 6}","El PSOE se pone en evidencia: es el único partido que no pedirá al Gobierno el convenio de carreteras de Mallorca | La Policía registra en Mallorca mansiones sospechosas de pertenecer a Nikolai Kolesov, oligarca ruso cercano a Putin | El zasca de Óscar Puente a María José Catalá: ""Se lleva la palma""",2026-03-09 22:32
Murcia,ES-MC,59,"{'google_news_es': 12, 'okdiario': 11, 'levante_emv': 10}","Vox nombra a José Manuel Pancorbo nuevo presidente del partido en la Región de Murcia | El PSOE se pone en evidencia: es el único partido que no pedirá al Gobierno el convenio de carreteras de Mallorca | Llorca y Puig, almuerzo cordial",2026-03-09 22:32
Cantabria,ES-CB,55,"{'google_news_es': 8, 'elcorreo': 6, 'expansion': 6}","La pasarela de Santander, cerrada con vallas: un ramo de flores recuerda a los seis jóvenes: «Era una tragedia evitable» | El delegado del Gobierno en Cantabria justifica su ausencia en el dispositivo de emergencia de la pasarela de Santander en que estaba en México cuando ocurrió la tragedia | Botín aprovecha la caída en Bolsa del Santander para comprar 300.000 acciones por tres millones",2026-03-09 22:32
Galicia,ES-GA,53,"{'google_news_es': 14, 'levante_emv': 6, '20minutos': 5}","Una generación de octogenarios vigorosos sitúa a Brasil en el mapa mundial de la longevidad | Santiago Abascal alerta a Feijóo del ""gravísimo error"" de ir de la mano del ""capo Pedro Sánchez"" para ""acabar con Vox"" | Alba Carrillo pregunta a Santiago Segura sobre lo que es el feminismo: ""Torrente es machirulismo""",2026-03-09 22:32
Canarias,ES-CN,38,"{'google_news_es': 18, '20minutos': 7, 'elmundo_espana': 3}","Esta es la playa de Canarias que está entre las mejores del mundo, según TripAdvisor | Nubes y precipitaciones débiles en el norte de las islas montañosas este martes - Tiempo de Canarias | Prisión por asesinato para la madre acusada de ahogar a su bebé en Las Palmas",2026-03-09 22:32
Extremadura,ES-EX,37,"{'levante_emv': 7, 'google_news_es': 5, 'elpais': 3}",Feijóo carga contra Vox por su bloqueo en Extremadura: «Estafa a sus votantes y da alegría al sanchismo» | Dos hermanos declaran ante la UCO por la desaparición de Francisca Cadenas en Badajoz en el año 2017 | Llega la 'apivoltaica': así se fusionan abejas y energía en Extremadura,2026-03-09 22:32
Castilla-La Mancha,ES-CM,36,"{'heraldo_aragon': 14, 'google_news_es': 11, 'okdiario': 3}",El Gobierno regional incrementa hasta los 150.000 euros las ayudas para promover la igualdad y la visibilización del colectivo LGTBI - Gobierno de Castilla-La Mancha | Seis detenidos de un grupo de ladrones que reventaba con explosivos cajeros de Castilla-La Mancha | Un estudio pionero revela que el Imperio romano excavó en Cuenca minas subterráneas enormes de más de 30 km,2026-03-09 22:32
Asturias,ES-AS,29,"{'google_news_es': 11, 'elpais': 4, 'eldiario': 3}",Ence invierte 11 millones en el mantenimiento y en la mejora de su fábrica de Navia (Asturias) | El matrimonio detenido en Oviedo por encerrar a sus hijos durante cuatro años se enfrenta a penas de 25 años de cárcel | Gala Premios AMAS 2026 - Ayuntamiento de Oviedo,2026-03-09 22:32
Navarra,ES-NC,11,"{'google_news_es': 6, 'elcorreo': 1, '20minutos': 1}","El gigante Hithium, que tiene un acuerdo con Euskadi, estudia una inversión de 400 millones en Navarra | Una empresa china estudia una posible inversión para desarrollar almacenamiento energético en Navarra | FIN DE SEMANA: 18 personas detenidas/investigadas y 34 accidentes viales atendidos. - navarra.es",2026-03-09 22:32
La Rioja,ES-RI,7,"{'20minutos': 2, 'eldiario': 2, 'google_news_es': 2}","La Guardia Civil interviene dos machetes, una mariposa y una karambit a dos personas en La Rioja | El monumental enfado de Luis Rioja al ser sustituido en el Valencia-Alavés: a puñetazos en el banquillo | Qué ver en La Rioja, el destino turístico menos masificado de España para disfrutar de un fin de semana tranquilo",2026-03-09 22:32
Ceuta,ES-CE,7,"{'google_news_es': 3, 'elpais': 1, 'okdiario': 1}","Anuncio de formalización de contratos de: Presidencia de la Confederación Hidrográfica del Guadalquivir. Objeto: Contrato de obras de implantación de los sistemas de auscultación de las presas de la Demarcación de Ceuta (Ceuta). Expediente: CE(DT)-63 - Derecho.com | El viaje de 6.400 kilómetros de ‘Diana’, la tortuga boba rescatada en Ceuta que cruzó el Atlántico | Las Palmas agranda su esperanza con una goleada al Ceuta (4-0) - UD Las Palmas | Web Oficial",2026-03-09 22:32
Melilla,ES-ML,2,{'google_news_es': 2},La UD Melilla ya mira a Chapín: vuelta al trabajo tras el empate ante el Antoniano - UD Melilla | La UD Melilla se conjura para la final ante el CA Antoniano - UD Melilla,2026-03-09 22:32
