ccaa,code,mentions,top_sources,top_titles,last_update
Aragón,ES-AR,343,"{'heraldo_aragon': 309, 'okdiario': 7, 'eldiario': 6}",El CSIC en Aragón conmemora el Día de la Mujer con una jornada sobre la igualdad | The Champions Burger regresa a Zaragoza: estas son las hamburgueserías que estarán y las fechas | Casi 40 multas de 50 a 200 euros por circular en patinete sin casco o sin chaleco en Huesca,2026-03-09 21:02
Madrid,ES-MD,308,"{'20minutos': 58, 'google_news_es': 40, 'okdiario': 31}","La justicia obliga a Ayuso a tramitar el registro de objetores del aborto, aunque Madrid recurrirá la medida | Agenda 2026. Milei confirmó que viajará a España para participar del Foro Económico de Madrid - La Voz del Interior | A bocados: ¿cuál es la tapa más representativa de Madrid?",2026-03-09 21:02
Cataluña,ES-CT,165,"{'lavanguardia': 46, 'okdiario': 23, 'elpais': 19}","El despacho Blas de Lezo compra 190m2 de oficinas a Inbisa en un punto estratégico de Barcelona | Muere un hombre mientras trabajaba en una empresa de San Fructuoso de Bages (Barcelona) | “No somos la Berlinale”, dice el Americana Film Fest de Barcelona, más político que nunca",2026-03-09 21:02
Andalucía,ES-AN,163,"{'google_news_es': 48, 'okdiario': 20, 'heraldo_aragon': 13}",La explosión de una granada en una discoteca de Perú evidencia el poder de las mafias | Dimite la concejal de Igualdad de un pueblo de Granada tras ser condenada por agredir a una vecina | El Cádiz trabaja «a contrarreloj» para el choque con el Mirandés,2026-03-09 21:02
Comunidad Valenciana,ES-VC,141,"{'levante_emv': 38, 'okdiario': 17, 'google_news_es': 15}","Centro de Arte Hortensia Herrero. La joya escondida de Valencia | Suma abre una tienda en el centro de Valencia preparada para el urbanita | Llega a Valencia y Alicante el 'DroneArt Show: Four Seasons', miles de drones vestirán el cielo los próximos fines de semana",2026-03-09 21:02
Castilla y León,ES-CL,125,"{'google_news_es': 18, 'okdiario': 17, 'levante_emv': 13}",Feijóo augura que Vox “bloqueará” también Castilla y León “por las elecciones andaluzas” | La encuesta de las 23:59: lea esta noche el último sondeo que se publicará sobre las elecciones de Castilla y León | Sorteo mesa electoral elecciones Castilla y León 2026: como saber si estoy en mesa electoral,2026-03-09 21:02
País Vasco,ES-PV,70,"{'elcorreo': 50, 'google_news_es': 5, 'okdiario': 4}",La Policía acude a un partido de cadetes en Vitoria con seis expulsados y amenazas al árbitro | El Surne Bilbao hace un llamamiento a la marea negra para grabar el vídeo del himno oficial del club | Lanzan una recogida de firmas en Treviño a favor de su integración en Euskadi,2026-03-09 21:02
Baleares,ES-IB,69,"{'okdiario': 29, 'google_news_es': 11, 'levante_emv': 6}","La Policía registra en Mallorca mansiones sospechosas de pertenecer a Nikolai Kolesov, oligarca ruso cercano a Putin | El zasca de Óscar Puente a María José Catalá: ""Se lleva la palma"" | Más plazas de FP y más recursos de orientación para reducir el abandono escolar en Baleares",2026-03-09 21:02
Murcia,ES-MC,57,"{'google_news_es': 12, 'okdiario': 10, 'levante_emv': 9}","Llorca y Puig, almuerzo cordial | Llorca tiene bastante con un Palau | La Policía registra en Mallorca mansiones sospechosas de pertenecer a Nikolai Kolesov, oligarca ruso cercano a Putin",2026-03-09 21:02
Cantabria,ES-CB,55,"{'google_news_es': 8, 'elcorreo': 6, 'expansion': 6}","La pasarela de Santander, cerrada con vallas: un ramo de flores recuerda a los seis jóvenes: «Era una tragedia evitable» | El delegado del Gobierno en Cantabria justifica su ausencia en el dispositivo de emergencia de la pasarela de Santander en que estaba en México cuando ocurrió la tragedia | Botín aprovecha la caída en Bolsa del Santander para comprar 300.000 acciones por tres millones",2026-03-09 21:02
Galicia,ES-GA,53,"{'google_news_es': 14, 'levante_emv': 6, '20minutos': 5}","Una generación de octogenarios vigorosos sitúa a Brasil en el mapa mundial de la longevidad | Santiago Abascal alerta a Feijóo del ""gravísimo error"" de ir de la mano del ""capo Pedro Sánchez"" para ""acabar con Vox"" | Alba Carrillo pregunta a Santiago Segura sobre lo que es el feminismo: ""Torrente es machirulismo""",2026-03-09 21:02
Canarias,ES-CN,38,"{'google_news_es': 18, '20minutos': 7, 'elmundo_espana': 3}","Esta es la playa de Canarias que está entre las mejores del mundo, según TripAdvisor | Nubes y precipitaciones débiles en el norte de las islas montañosas este martes - Tiempo de Canarias | Prisión por asesinato para la madre acusada de ahogar a su bebé en Las Palmas",2026-03-09 21:02
Extremadura,ES-EX,36,"{'levante_emv': 7, 'google_news_es': 5, 'infolibre': 3}","Dos hermanos declaran ante la UCO por la desaparición de Francisca Cadenas en Badajoz en el año 2017 | Llega la 'apivoltaica': así se fusionan abejas y energía en Extremadura | CIBEREXT, una iniciativa clave para la ciberseguridad del tejido empresarial extremeño - El Periódico Extremadura",2026-03-09 21:02
Castilla-La Mancha,ES-CM,36,"{'heraldo_aragon': 14, 'google_news_es': 11, 'okdiario': 3}",El Gobierno regional incrementa hasta los 150.000 euros las ayudas para promover la igualdad y la visibilización del colectivo LGTBI - Gobierno de Castilla-La Mancha | Seis detenidos de un grupo de ladrones que reventaba con explosivos cajeros de Castilla-La Mancha | Un estudio pionero revela que el Imperio romano excavó en Cuenca minas subterráneas enormes de más de 30 km,2026-03-09 21:02
Asturias,ES-AS,29,"{'google_news_es': 11, 'elpais': 4, 'eldiario': 3}",Ence invierte 11 millones en el mantenimiento y en la mejora de su fábrica de Navia (Asturias) | El matrimonio detenido en Oviedo por encerrar a sus hijos durante cuatro años se enfrenta a penas de 25 años de cárcel | Gala Premios AMAS 2026 - Ayuntamiento de Oviedo,2026-03-09 21:02
Navarra,ES-NC,9,"{'google_news_es': 6, 'okdiario': 1, 'google_news_politica': 1}","FIN DE SEMANA: 18 personas detenidas/investigadas y 34 accidentes viales atendidos. - navarra.es | La figura de Lurdes Iriondo, pionera de la cultura en euskera, protagoniza el documental que se proyecta este martes en Condestable - Ayuntamiento de Pamplona | El Gobierno de Navarra recuerda que ""la igualdad existe cuando se practica” y que “el feminismo nos ayuda a cuestionar lo que hemos naturalizado” - navarra.es",2026-03-09 21:02
La Rioja,ES-RI,7,"{'20minutos': 2, 'eldiario': 2, 'google_news_es': 2}","La Guardia Civil interviene dos machetes, una mariposa y una karambit a dos personas en La Rioja | El monumental enfado de Luis Rioja al ser sustituido en el Valencia-Alavés: a puñetazos en el banquillo | Qué ver en La Rioja, el destino turístico menos masificado de España para disfrutar de un fin de semana tranquilo",2026-03-09 21:02
Ceuta,ES-CE,7,"{'google_news_es': 3, 'elpais': 1, 'okdiario': 1}","Anuncio de formalización de contratos de: Presidencia de la Confederación Hidrográfica del Guadalquivir. Objeto: Contrato de obras de implantación de los sistemas de auscultación de las presas de la Demarcación de Ceuta (Ceuta). Expediente: CE(DT)-63 - Derecho.com | El viaje de 6.400 kilómetros de ‘Diana’, la tortuga boba rescatada en Ceuta que cruzó el Atlántico | Las Palmas agranda su esperanza con una goleada al Ceuta (4-0) - UD Las Palmas | Web Oficial",2026-03-09 21:02
Melilla,ES-ML,2,{'google_news_es': 2},La UD Melilla ya mira a Chapín: vuelta al trabajo tras el empate ante el Antoniano - UD Melilla | La UD Melilla se conjura para la final ante el CA Antoniano - UD Melilla,2026-03-09 21:02
