ccaa,code,mentions,top_sources,top_titles,last_update
Aragón,ES-AR,644,"{'heraldo_aragon': 568, 'eldiario': 13, 'okdiario': 12}","Giro radical del tiempo en Zaragoza: entre el 14 y el 15 de marzo volverá el frío | Arte callejero en el centro de Zaragoza en el día contra las agresiones a sanitarios: se ataca a un médico cada 10 horas | Polémica por el pino del parque Bruil de Zaragoza: &quot;Es peligroso, según una evaluación técnica. Puede caerse y matar a alguien&quot;",2026-03-12 12:33
Madrid,ES-MD,591,"{'20minutos': 106, 'google_news_es': 93, 'okdiario': 54}",Detenido un enfermero de un colegio Leganés por agredir sexualmente a seis menores | Madrid Economic Forum: la generación de la Libertad | Desfile multitudinario en Madrid para celebrar la fiesta de San Patricio: participarán más de 40 bandas,2026-03-12 12:33
Cataluña,ES-CT,346,"{'lavanguardia': 77, 'okdiario': 56, '20minutos': 42}","Junts da luz verde al plan municipal que permitirá el Museo Thyssen en Barcelona | La Diputación de Barcelona detecta y repara 700 fugas de agua | La líder de Podem Catalunya denuncia amenazas neonazis y la ""vandalización"" de su vehículo",2026-03-12 12:33
Andalucía,ES-AN,277,"{'google_news_es': 76, 'okdiario': 39, '20minutos': 23}","El Gobierno eleva la presión a la Junta de Andalucía y solicita también una reunión extraordinaria del Estadio Cartuja tras la imputación del gerente | El COM Málaga llama a la prevención y al diagnóstico precoz en el Día Mundial del Riñón - medicosypacientes.com | Las víctimas del accidente de Adamuz estallan: el 20 de marzo se manifestarán en Huelva para exigir ""toda la verdad""",2026-03-12 12:33
Castilla y León,ES-CL,266,"{'okdiario': 37, 'google_news_es': 30, 'levante_emv': 28}",Una pintada en verde con las letras VOX daña el Arco de Santa María en el centro de Burgos | Martínez (PSOE) omite que la deuda de Castilla y León ha bajado en relación con el PIB desde que Mañueco es presidente | Las denuncias por violación han aumentado en Castilla y León desde 2018 pero no un 374% como dice Pollán (Vox),2026-03-12 12:33
Comunidad Valenciana,ES-VC,262,"{'levante_emv': 92, 'okdiario': 41, 'google_news_es': 22}","Centro de Arte Hortensia Herrero. La joya escondida de Valencia | Morrissey cancela su concierto en Valencia por ""falta de sueño"" | Morrissey cancela el concierto en Valencia dos días antes de actuar en Zaragoza",2026-03-12 12:33
País Vasco,ES-PV,168,"{'elcorreo': 126, 'okdiario': 10, 'google_news_es': 9}",Apnea del sueño: el peligro invisible que multiplica el riesgo de ictus e hipertensión - Radio Popular de Bilbao | Canarias y País Vasco piden a Pedro Sánchez una Conferencia de Presidentes urgente por la guerra de Irán | Canarias y Euskadi piden una Conferencia de Presidentes urgente por la guerra de Irán,2026-03-12 12:33
Baleares,ES-IB,136,"{'okdiario': 61, 'google_news_es': 14, 'levante_emv': 10}","Los pirómanos atacan de nuevo: varios incendios declarados en contenedores de Palma | ‘Atraco’ con vistas al mar: así son los precios del nuevo Parador de Ibiza, el hotel público donde un café cuesta 6 euros | Ibiza multiplica por cinco el dinero dedicado al cuidado y manutención de menas: 12,5 millones",2026-03-12 12:33
Murcia,ES-MC,111,"{'okdiario': 26, 'levante_emv': 19, 'google_news_es': 13}","Llorca defiende que Catalá ""sugirió"" cortar los trenes y atribuye a Puente la responsabilidad de ""plantear soluciones"" | Es uno de los mejores platos de cuchara que tenemos en España, pero lo disfrutan sólo los murcianos en Cuaresma | Pasión Vega: ""Almodóvar y Lorca son dos mentes adelantadas a su tiempo que nos hablan de libertad""",2026-03-12 12:33
Galicia,ES-GA,97,"{'google_news_es': 29, '20minutos': 13, 'levante_emv': 12}",Tensión en Vigo antes del Celta - Lyon de Europa League: al menos 3 heridos en una pelea multitudinaria | Tensión en Vigo antes del Celta - Lyon de Europa League: al menos 3 heridos en una multitudinaria pelea | Varios heridos y destrozos en Vigo en una pelea entre ultras del Celta y el Lyon,2026-03-12 12:33
Cantabria,ES-CB,81,"{'expansion': 11, 'elcorreo': 10, 'google_news_es': 10}","Julià (Banco Santander) asegura la banca española afronta el conflicto en Irán ""más fuerte que nunca"" | La investigación avanza que los tornillos de la pasarela de Santander estaban muy oxidados | ""Tornillos oxidados y alta degradación"": avanza la investigación de la pasarela de El Bocal de Santander",2026-03-12 12:33
Extremadura,ES-EX,65,"{'levante_emv': 15, 'google_news_es': 8, 'okdiario': 5}","Cinco aspirantes se postulan para liderar el PSOE de Extremadura | La Guardia Civil confirma que los huesos hallados en Badajoz son de Francisca Cadenas, desaparecida en 2017 | La Guardia Civil confirma que los huesos hallados en Badajoz son de Francisca Cadenas, desparecida en 2017",2026-03-12 12:33
Canarias,ES-CN,56,"{'google_news_es': 23, '20minutos': 10, 'levante_emv': 5}",Aprobado el decreto estatal que protege las praderas submarinas del Mediterráneo y Canarias | Canarias y País Vasco piden a Pedro Sánchez una Conferencia de Presidentes urgente por la guerra de Irán | Canarias y Euskadi piden una Conferencia de Presidentes urgente por la guerra de Irán,2026-03-12 12:33
Asturias,ES-AS,56,"{'google_news_es': 16, 'levante_emv': 9, 'elcorreo': 7}","No llega a 100 años pero dicen que es la ermita más bonita de España, y una de las grandes joyas ocultas de Asturias | Ni con enfermedad mental ni maltratadores: los peritos salen en defensa de los padres acusados de retener a sus hijos en la 'casa de los horrores' Oviedo | Los padres de la 'casa de los horrores' de Oviedo alegan «miedo» a salir de allí en la pandemia",2026-03-12 12:33
Castilla-La Mancha,ES-CM,47,"{'heraldo_aragon': 17, 'google_news_es': 13, 'okdiario': 3}","Las monjas cismáticas de Belorado se trasladan a Toledo | La deuda del Estado con Castilla-La Mancha desde hace 40 años: 3.100 metros cuadrados de instalaciones públicas pendientes | Qué hay detrás de la “masacre” de cientos de ciervos, gamos y venados en una finca pública de Ciudad Real",2026-03-12 12:33
Navarra,ES-NC,34,"{'google_news_es': 11, 'elcorreo': 7, 'elmundo': 3}","Baluarte inaugura este viernes ‘Abestu Euskadiko Orkestrarekin’, con 132 voces ciudadanas cantando junto a Euskadiko Orkestra - Noticias de Navarra | El stock del alquiler se desploma a doble dígito en las zonas declaradas tensionadas: Pamplona pierde el 26% de su oferta y A Coruña el 21% | El 'boom' de Clara Galle: su camino al éxito desde Pamplona a ser la actriz favorita de Netflix",2026-03-12 12:33
Ceuta,ES-CE,14,"{'google_news_es': 3, 'elpais': 2, 'google_news_politica': 2}",Muere un joven que quedó herido en un tiroteo en la barriada de El Príncipe de Ceuta | Muere un joven tras un tiroteo en Ceuta: le han disparado varias personas cubiertas con pasamontañas | Vox critica que el Gobierno invierta en sanidad en Marruecos con las carencias de España - El Pueblo de Ceuta,2026-03-12 12:33
La Rioja,ES-RI,11,"{'20minutos': 3, 'okdiario': 2, 'eldiario': 2}",La preocupación entre los expertos es total: lo que pasa en un embalse en La Rioja con las especies protegidas en riesgo | Liberadas seis personas de origen asiático cuasi esclavizadas: eran obligadas a trabajar hasta 14 horas cada día en La Rioja | Detenidos por explotar a seis trabajadores y obligarles a trabajar 14 horas al día en La Rioja,2026-03-12 12:33
Melilla,ES-ML,6,"{'levante_emv': 2, 'google_news_es': 2, 'lavanguardia': 1}","Detenido en Melilla un presunto yihadista en una operación de la Policía Nacional | Los ciudadanos de Ceuta y Melilla suspenden con un 3,7 la gestión sanitaria del Gobierno central | Tesseo: los ciudadanos de Ceuta y Melilla suspenden la gestión sanitaria del Gobierno central",2026-03-12 12:33
