cluster,cluster_label,count,last_update
0,así euros millones nuevo zaragoza,14931,2026-03-15 04:00
1,eeuu irán líder ormuz trump,1337,2026-03-15 04:00
2,años irán quot si zaragoza,912,2026-03-15 04:00
3,españa gobierno guerra irán medidas,549,2026-03-15 04:00
4,2026 comprobar horóscopo hoy marzo,989,2026-03-15 04:00
5,com españa guerra sánchez trump,1037,2026-03-15 04:00
6,castilla león pp tras vox,1016,2026-03-15 04:00
7,cadenas detenidos dos francisca tras,605,2026-03-15 04:00
8,ee guerra irán israel uu,486,2026-03-15 04:00
9,años cárcel después muere tras,836,2026-03-15 04:00
10,cómo irán puede ser trump,263,2026-03-15 04:00
11,atlético city directo madrid real,695,2026-03-15 04:00
12,039 españa guerra quot zaragoza,171,2026-03-15 04:00
13,aemet hoy marzo previsión tiempo,173,2026-03-15 04:00
14,directo guerra irán oriente trump,1280,2026-03-15 04:00
