cluster,cluster_label,count,last_update
0,años escritor habermas muere tras,199,2026-03-15 04:30
1,así ia irán sido vídeo,175,2026-03-15 04:30
2,guerra irán israel trump uu,2058,2026-03-15 04:30
3,gobierno incendio miranda nueva tres,1008,2026-03-15 04:30
4,2026 alcaraz dónde indian ver,654,2026-03-15 04:30
5,com españa guerra irán trump,1020,2026-03-15 04:30
6,039 años irán quot zaragoza,955,2026-03-15 04:30
7,2026 8m día internacional mujer,388,2026-03-15 04:30
8,2026 comprobar hoy marzo sábado,570,2026-03-15 04:30
9,dos nuevo tras trump zaragoza,14739,2026-03-15 04:30
10,atlético city directo madrid real,690,2026-03-15 04:30
11,españa guerra pedro sánchez trump,556,2026-03-15 04:30
12,000 dólares euros millones petróleo,1182,2026-03-15 04:30
13,blanca casa horrores padres rihanna,344,2026-03-15 04:30
14,años cárcel después hace tras,757,2026-03-15 04:30
