title,link,source,date
Así gestionan nuestros vecinos europeos la expansión de Airbnb,https://elpais.com/internacional/2020/02/21/sonar_europe/1582302332_702790.html#?ref=rss&format=simple&link=link,https://elpais.com/rss/elpais/portada.xml,"Wed, 26 Feb 2020 20:05:03 +0200"
Trump nombra al vicepresidente Pence a cargo de la crisis del coronavirus,https://elpais.com/sociedad/2020/02/27/actualidad/1582762594_400436.html#?ref=rss&format=simple&link=link,https://elpais.com/rss/elpais/portada.xml,"Thu, 27 Feb 2020 19:26:58 +0200"
“La magnitud del problema del coronavirus no será diferente a una gripe”,https://elpais.com/sociedad/2020/02/26/actualidad/1582744701_468958.html#?ref=rss&format=simple&link=link,https://elpais.com/rss/elpais/portada.xml,"Thu, 27 Feb 2020 19:26:43 +0200"
Consumo da la razón a los clientes de Fnac que compraron un móvil 575 euros más barato por un error,https://elpais.com/sociedad/2020/02/27/actualidad/1582796975_880373.html#?ref=rss&format=simple&link=link,https://elpais.com/rss/elpais/portada.xml,"Thu, 27 Feb 2020 17:15:33 +0200"
"Un periodista que viajó a Milán para cubrir el Valencia-Atalanta, positivo por coronavirus",https://elpais.com/sociedad/2020/02/27/actualidad/1582795523_075914.html#?ref=rss&format=simple&link=link,https://elpais.com/rss/elpais/portada.xml,"Thu, 27 Feb 2020 17:13:44 +0200"
Ciudadanos pagaba un sueldo a un vocal de la Junta Electoral Central que resolvió recursos del partido,https://elpais.com/politica/2020/02/27/actualidad/1582796971_717381.html#?ref=rss&format=simple&link=link,https://elpais.com/rss/elpais/portada.xml,"Thu, 27 Feb 2020 17:13:35 +0200"
El turismo italiano se resiente; España mira expectante,https://elpais.com/sociedad/2020/02/26/actualidad/1582751511_964259.html#?ref=rss&format=simple&link=link,https://elpais.com/rss/elpais/portada.xml,"Thu, 27 Feb 2020 15:26:25 +0200"
El coronavirus de Wuhan | Japón cerrará todos sus centros escolares hasta fin de marzo,https://elpais.com/sociedad/2020/02/27/actualidad/1582772469_101682.html#?ref=rss&format=simple&link=link,https://elpais.com/rss/elpais/portada.xml,"Thu, 27 Feb 2020 15:08:21 +0200"
¿Por qué los mosquitos se ceban con nuestros tobillos?,https://elpais.com/elpais/2020/02/27/ciencia/1582797400_512615.html#?ref=rss&format=simple&link=link,https://elpais.com/rss/elpais/portada.xml,"Thu, 27 Feb 2020 14:25:21 +0200"
50 antiguos ministros y dirigentes europeos se pronuncian contra el plan de Trump para Palestina,https://elpais.com/internacional/2020/02/26/actualidad/1582750435_447092.html#?ref=rss&format=simple&link=link,https://elpais.com/rss/elpais/portada.xml,"Thu, 27 Feb 2020 13:42:56 +0200"
Seis italianos encerrados por partida doble,https://elpais.com/sociedad/2020/02/26/actualidad/1582745125_354016.html#?ref=rss&format=simple&link=link,https://elpais.com/rss/elpais/portada.xml,"Thu, 27 Feb 2020 13:36:34 +0200"
La Fiscalía se querella contra una mujer por tuitear un vídeo falso de menores migrantes,https://elpais.com/ccaa/2020/02/27/catalunya/1582793229_305704.html#?ref=rss&format=simple&link=link,https://elpais.com/rss/elpais/portada.xml,"Thu, 27 Feb 2020 13:21:28 +0200"
Especial EL PAÍS en Arco | Muntadas: “La sociedad ha degradado las palabras”,https://elpais.com/elpais/2020/02/27/actualidad/1582803771_531979.html#?ref=rss&format=simple&link=link,https://elpais.com/rss/elpais/portada.xml,"Thu, 27 Feb 2020 12:49:20 +0200"
China desvela de qué está hecha la cara oculta de la Luna,https://elpais.com/elpais/2020/02/25/ciencia/1582651238_235155.html#?ref=rss&format=simple&link=link,https://elpais.com/rss/elpais/portada.xml,"Thu, 27 Feb 2020 11:43:38 +0200"
La mesa de diálogo se reunirá mensualmente y los acuerdos serán “en el marco de la seguridad jurídica”,https://elpais.com/politica/2020/02/26/actualidad/1582729437_069559.html#?ref=rss&format=simple&link=link,https://elpais.com/rss/elpais/portada.xml,"Thu, 27 Feb 2020 11:31:31 +0200"
Así avanzan las encuestas en Galicia y País Vasco,https://elpais.com/politica/2020/02/26/actualidad/1582705222_037590.html#?ref=rss&format=simple&link=link,https://elpais.com/rss/elpais/portada.xml,"Thu, 27 Feb 2020 11:00:21 +0200"
Javier Bardem: “Hoy hay algún Hernán Cortés en el Congreso”,https://elpais.com/cultura/2020/02/26/actualidad/1582734306_817032.html#?ref=rss&format=simple&link=link,https://elpais.com/rss/elpais/portada.xml,"Thu, 27 Feb 2020 10:30:32 +0200"
"La historia de Duralex, una vajilla tan irrompible como nuestra nostalgia",https://elpais.com/verne/2020/02/25/articulo/1582628993_071991.html#?ref=rss&format=simple&link=link,https://elpais.com/rss/elpais/portada.xml,"Thu, 27 Feb 2020 08:27:18 +0200"
Mapa de la expansión y claves para entender el coronavirus de Wuhan,https://elpais.com/sociedad/2020/02/26/actualidad/1582712658_011286.html#?ref=rss&format=simple&link=link,https://elpais.com/rss/elpais/portada.xml,"Sun, 1 Mar 2020 15:16:43 +0200"
Plácido Domingo anula sus representaciones en el Real antes de que el teatro las cancelara,https://elpais.com/cultura/2020/02/27/actualidad/1582789321_585769.html#?ref=rss&format=simple&link=link,https://elpais.com/rss/elpais/portada.xml,"Fri, 28 Feb 2020 09:33:16 +0200"
El Gobierno salva el primer escollo de los Presupuestos gracias a ERC,https://elpais.com/politica/2020/02/27/actualidad/1582790343_062149.html#?ref=rss&format=simple&link=link,https://elpais.com/rss/elpais/portada.xml,"Fri, 28 Feb 2020 08:19:36 +0200"
Los alumnos de la Autónoma acorralan a los 150 radicales del violento escrache a Felipe González,http://www.abc.es,https://www.abc.es/rss/feeds/abcPortada.xml,"Fri, 21 Oct 2016 00:34:22 +0200"
La fundación Robert Capa prohíbe a Almeida usar el nombre del fotógrafo para crear un centro en la casa Peironcely 10 y el Ayuntamiento estudiará la posibilidad de mantenerlo,https://www.elmundo.es/madrid/2026/03/06/69ab0136e9cf4a6f5e8b459d.html,El Mundo,2026-03-06 16:31:27
"Decodifican las 'tuberías del cerebro': el líquido cefalorraquídeo, clave para entender y combatir los tumores",https://www.elmundo.es/ciencia-y-salud/salud/2026/03/06/69aaf8e3fc6c8357058b4570.html,El Mundo,2026-03-06 16:09:14
"Rabia y miedo entre la diáspora iraní mientras Teherán sufre la peor noche de ataques: ""Odio al régimen, pero no veo cómo esta guerra puede traer algo bueno""",https://www.elmundo.es/internacional/2026/03/06/69aaf228e85ece623a8b45ab.html,El Mundo,2026-03-06 15:35:43
"Los sindicatos médicos CESM y Amyts rebajan el optimismo de Sanidad: ""No hay ningún acuerdo""",https://www.elmundo.es/ciencia-y-salud/salud/2026/03/06/69aaedb0e85ece60688b45b3.html,El Mundo,2026-03-06 15:07:40
"Las bolsas globales aceleran las caídas tras la advertencia de Qatar del posible corte en el suministro de gas y petróleo ""en unos días""",https://www.elmundo.es/economia/dinero-inversion/2026/03/06/69aa877ee9cf4a87418b45aa.html,El Mundo,2026-03-06 14:53:59
Procesado el exjefe de la UDEF que tenía 20 millones en su casa fruto del narcotráfico,https://www.elmundo.es/espana/2026/03/06/69aae815fdddff201c8b458d.html,El Mundo,2026-03-06 14:51:21
Sánchez no someterá a votación del Congreso el envío de la fragata Colón amparándose en la ley de Defensa Nacional,https://www.elmundo.es/espana/2026/03/06/69aadeaffc6c83866d8b4586.html,El Mundo,2026-03-06 14:03:34
"Vox tumba a Guardiola por segunda vez,pero Abascal abre la puerta antes de larepetición electoral: ""Hay mucho tiempo""",https://www.elmundo.es/espana/extremadura/2026/03/06/69aad1ccfc6c83ea518b45c6.html,El Mundo,2026-03-06 13:59:13
"Detenido un hombre que mantenía retenida en un piso a su ex mujer, quien pidió auxilio lanzando una nota por la ventana",https://www.elmundo.es/cataluna/2026/03/06/69aadb8fe9cf4a666e8b45ae.html,El Mundo,2026-03-06 13:53:13
"Las bolsas europeas aceleran las caídas tras la advertencia de Qatar del posible corte en el suministro de gas y petróleo ""en unos días""",https://www.elmundo.es/economia/dinero-inversion/2026/03/06/69aa877ee9cf4a87418b45aa.html,El Mundo,2026-03-06 13:30:13
"Alessandra Rojo, alcaldesa mexicana premiada por Ayuso y víctima de un atentado: ""Me intentaron silenciar, pero cuando decides defender la libertad, ya no hay marcha atrás""",https://www.elmundo.es/madrid/2026/03/06/69a9e84ee85eced3048b4591.html,El Mundo,2026-03-06 12:40:41
"Ayuso premia a YO DONA como ""referente en la información sobre moda, cultura y talento femenino""",https://www.elmundo.es/madrid/2026/03/06/69aabbc121efa03b7b8b4579.html,El Mundo,2026-03-06 12:33:47
La alcaldesa de Santander sancionará a la policía local que no comunicó el aviso sobre el peligro de la pasarela de El Bocal,https://www.elmundo.es/espana/2026/03/06/69aac101e4d4d8e1228b4578.html,El Mundo,2026-03-06 12:22:15
"Las bolsas europeas aceleran las caídas tras el anuncio de Qatar del posible corte en el suministro de petróleo ""en unos días""",https://www.elmundo.es/economia/dinero-inversion/2026/03/06/69aa877ee9cf4a87418b45aa.html,El Mundo,2026-03-06 12:16:04
"Las mejores hipotecas fijas, mixtas y variables de marzo de 2026",https://www.elmundo.es/economia/vivienda/2026/03/06/69aab1a521efa00c578b4582.html,El Mundo,2026-03-06 12:05:55
"La inflación subirá por encima del 3% y el PIB crecerá dos décimas menos de lo esperado en 2026 por la guerra en Irán, según Funcas",https://www.elmundo.es/economia/macroeconomia/2026/03/06/69aabf08fc6c8397128b457a.html,El Mundo,2026-03-06 12:00:04
La muerte de los cinco jóvenes en Manlleu fue accidental tras el incendio de un colchón por una colilla,https://www.elmundo.es/cataluna/2026/03/06/69aabd70e85ece60688b459d.html,El Mundo,2026-03-06 11:59:08
La UEFA multa con 15.000 euros al Real Madrid y una advertencia de cierre por la actitud racista del público ante el Benfica,https://www.elmundo.es/deportes/futbol/champions-league/2026/03/06/69aac0eae85ecefd0f8b459d.html,El Mundo,2026-03-06 11:56:36
"Sánchez recuerda a los fallecidos de la Universidad Internacional de Andalucía en el accidente de Adamuz ante la ""perplejidad"" del resto de víctimas",https://www.elmundo.es/espana/2026/03/06/69aab9f6e85ecedd208b4599.html,El Mundo,2026-03-06 11:38:36
La Policía de Indonesia detiene al capitán del barco que naufragó con una familia valenciana a bordo,https://www.elmundo.es/comunidad-valenciana/2026/03/06/69aab99be9cf4afb538b4595.html,El Mundo,2026-03-06 11:25:18
"El Ayuntamiento de Santander abre un expediente sancionador al agente local que no actuó tras el aviso sobre el riesgo en la pasarela: ""No se hizo lo correcto""",https://www.elmundo.es/espana/2026/03/06/69a9db9421efa0c7218b45aa.html,El Mundo,2026-03-06 11:04:40
Marlaska nombra al jefe superior de Baleares nuevo número dos de la Policía Nacional,https://www.elmundo.es/espana/2026/03/06/69aab126e4d4d8dd418b4596.html,El Mundo,2026-03-06 11:01:40
¿Cuántos misiles y cuántas bombas les quedan a los ayatolás de Irán? Los cálculos y la realidad,https://www.elmundo.es/internacional/2026/03/06/69aab005e85ecea8598b4570.html,El Mundo,2026-03-06 10:50:14
Investigan la muerte de un paciente de Bellvitge que sufrió quemaduras en la ducha del hospital,https://www.elmundo.es/cataluna/2026/03/06/69aaae2afdddfff77a8b4584.html,El Mundo,2026-03-06 10:36:31
"Kilian Jornet: ""Cada año pierdo amigos; eso me recuerda que debemos hacer lo que nos llena""",https://www.elmundo.es/papel/2026/03/06/69a6801fe4d4d8ac028b45a0.html,El Mundo,2026-03-06 10:33:04
"El ex jefe de los Mossos d'Esquadra, Eduard Sallent, destituido tras la detención fallida de Puigdemont, deja el cuerpo policial",https://www.elmundo.es/cataluna/2026/03/06/69aaa6bce4d4d867728b45ba.html,El Mundo,2026-03-06 10:10:04
"Sánchez comparecerá en el Congreso por Oriente Próximo mientras el PP le exige que pida permiso porque ""pone en peligro la vida de nuestros militares""",https://www.elmundo.es/espana/2026/03/06/69aa84dde4d4d8c9028b4570.html,El Mundo,2026-03-06 10:03:22
"La Audiencia de Valencia rechaza que Sánchez declare por la dana para evitar ""conjeturas"" sobre su conversación con Mazón",https://www.elmundo.es/comunidad-valenciana/2026/03/06/69aa9f41e85ece623a8b459a.html,El Mundo,2026-03-06 09:35:29
Las grandes petroleras instan al Gobierno a evitar ayudas directas a la gasolina como el descuento de 20 céntimos de la crisis de Ucrania,https://www.elmundo.es/economia/empresas/2026/03/06/69aa9879fc6c83ea518b459b.html,El Mundo,2026-03-06 09:12:37
Investigan a una guardería de una pedanía de Jerez (Cádiz) por supuestos malos tratos,https://www.elmundo.es/andalucia/2026/03/06/69aa931ae85ece5c348b4575.html,El Mundo,2026-03-06 08:48:41
"Teodor Davidov, el adolescente ambidiestro que nunca pega de revés y que ya suma puntos ATP",https://www.elmundo.es/deportes/tenis/2026/03/05/699b6c53e9cf4a5e128b4586.html,El Mundo,2026-03-06 08:35:00
"El PP exige a Sánchez pasar por el Congreso para el envío de la Cristóbal Colón a Chipre: ""Pone en peligro la vida de nuestros militares""",https://www.elmundo.es/espana/2026/03/06/69aa84dde4d4d8c9028b4570.html,El Mundo,2026-03-06 08:02:56
"Aston Martin es un despropósito: Fernando Alonso, fuera de la primera sesión, sólo puede rodar 17 vueltas después",https://www.elmundo.es/deportes/formula-1/2026/03/06/69aa699ce9cf4ad5678b4574.html,El Mundo,2026-03-06 06:23:02
"Aston Martin es un despropósito: Fernando Alonso, fuera de la primera sesión, sólo puede rodar 18 vueltas después",https://www.elmundo.es/deportes/formula-1/2026/03/06/69aa699ce9cf4ad5678b4574.html,El Mundo,2026-03-06 06:23:02
El cierre del estrecho de Ormuz asfixia a Asia y pone en jaque a las mayores economías del continente,https://www.elmundo.es/economia/macroeconomia/2026/03/06/69a9abece4d4d8e2378b45b5.html,El Mundo,2026-03-06 03:51:51
Washington y Caracas restablecen relaciones diplomáticas siete años después y transcurridos sólo dos meses y dos días de la captura de Maduro,https://www.elmundo.es/internacional/2026/03/06/69aa2e6ee4d4d803128b459c.html,El Mundo,2026-03-06 01:40:04
En los pasillos del poder chino: lo que piensan los diputados sobre la guerra en Oriente Próximo,https://www.elmundo.es/internacional/2026/03/06/69a9b040e9cf4afb688b45aa.html,El Mundo,2026-03-06 01:16:31
"Ángel Losada, ex embajador en Teherán: ""La muerte de Jamenei no va a implicar la caída del régimen, lo hace más peligroso""",https://www.elmundo.es/internacional/2026/03/06/69a82089e4d4d803338b4576.html,El Mundo,2026-03-06 01:14:59
"El Ayuntamiento de Santander se aferra a que la pasarela de los seis muertos no era ""obra liquidada"" y apunta al ministerio",https://www.elmundo.es/espana/2026/03/06/69a9db9421efa0c7218b45aa.html,El Mundo,2026-03-06 01:09:12
"Fernando Campos, presidente de IDIS: ""La sanidad pública sola no puede absorber la demanda creciente""",https://www.elmundo.es/ciencia-y-salud/salud/2026/03/06/69a9b1bce85eced45b8b4587.html,El Mundo,2026-03-06 01:08:40
"Fernando Campos, presidente de IDIS: ""La sanidad pública por sí sola no puede absorber la demanda creciente""",https://www.elmundo.es/ciencia-y-salud/salud/2026/03/06/69a9b1bce85eced45b8b4587.html,El Mundo,2026-03-06 01:08:40
"La industria advierte de que el absentismo, con un coste de 3.100 millones anuales, ya afecta a su competitividad",https://www.elmundo.es/economia/macroeconomia/2026/03/06/69a9877ee9cf4a3c438b459d.html,El Mundo,2026-03-06 01:08:04
Los chips se enredan en la burocracia de Bruselas y se quedan fuera del plan para reactivar el 'Made in Europe',https://www.elmundo.es/economia/empresas/2026/03/06/69a99b76e4d4d8f7528b458a.html,El Mundo,2026-03-06 01:02:53
Así ha conseguido Mango resurgir tras la muerte de Isak Andic,https://www.elmundo.es/economia/empresas/2026/03/06/69a9ca7821efa0d1248b4575.html,El Mundo,2026-03-06 01:01:06
"Ucrania acusa a Hungría de tomar como ""rehenes"" a siete empleados de banco ucraniano en Budapest",https://www.elmundo.es/internacional/2026/03/06/69aa14c6e9cf4a96468b4594.html,El Mundo,2026-03-05 23:49:24
La familia 'okupa' con las mejores vista de la bahía de Palma a la que el Obispado quiere desahuciar,https://www.elmundo.es/cronica/2026/03/06/699d6911fc6c832d4c8b457a.html,El Mundo,2026-03-05 23:06:03
"Del recetario tradicional a los arroces y las brasas, seis nuevos restaurantes de Madrid que ya dan mucho que hablar",https://www.elmundo.es/metropoli/gastronomia/2026/03/06/69a9b515e85ece022f8b458f.html,El Mundo,2026-03-05 23:06:02
"Dionisio, el primer muerto del independentismo catalán que nadie recuerda: ""Mi padre ha sido siempre una víctima olvidada""",https://www.elmundo.es/espana/2026/03/06/69a9d52621efa0c4748b45bb.html,El Mundo,2026-03-05 23:06:02
"Baldoria: la mejor pizza del mundo, bloody mary... por 40 pavos (y pagó tito Javier con lechuguitas)",https://www.elmundo.es/madrid/2026/03/06/69a6d5bafc6c8329218b4598.html,El Mundo,2026-03-05 23:04:14
El Ayuntamiento de Madrid ofrece protección policial a Rita Maestre tras hacerse pública su dirección en páginas de prostitución,https://www.elmundo.es/madrid/2026/03/06/69a9c2aae4d4d8bf258b458b.html,El Mundo,2026-03-05 23:04:08
"Kilian Jornet: ""Nunca he querido morir en la montaña y nunca lo querré""",https://www.elmundo.es/papel/2026/03/06/69a6801fe4d4d8ac028b45a0.html,El Mundo,2026-03-05 23:02:29
"Viaje al experimento digital más grande de la Historia: ""La prohibición de las redes sociales a los menores supone un reajuste global del poder""",https://www.elmundo.es/papel/historias/2026/03/06/69a1d64ce85ece005b8b4581.html,El Mundo,2026-03-05 23:02:29
"Un nuevo número de Yo Dona, mañana sábado 7 de marzo, en tu quiosco con El Mundo",https://www.elmundo.es/yodona/actualidad/2026/03/06/69a6f4befc6c83a23b8b4598.html,El Mundo,2026-03-05 23:00:23
Ni proteína ni creatina: los emprendedores tras el nuevo oro del wellness. ¿Y si no estás cansado sino deshidratado?,https://www.elmundo.es/yodona/vida-saludable/2026/03/06/69a85406e9cf4ad72e8b4581.html,El Mundo,2026-03-05 23:00:22
"Diana Al Azem, sobre las madres quemadas: ""Tenemos que meternos en la ducha y relajarnos, no aprovechar para limpiar la mampara""",https://www.elmundo.es/yodona/actualidad/2026/03/06/69a80985fc6c834e1d8b4591.html,El Mundo,2026-03-05 23:00:21
"Todos contra todos en Castilla y León: los candidatos de PP, PSOE y Vox se acusan mutuamente de hacer ""pinza"" con los demás",https://www.elmundo.es/elecciones/elecciones-castilla-y-leon/2026/03/05/69a9dc35fdddff07098b459b.html,El Mundo,2026-03-05 22:27:49
"La aviación israelí bombardea Beirut mientras cientos de miles de personas huyen: ""Salvad vuestras vidas""",https://www.elmundo.es/internacional/2026/03/05/69a9ca8e21efa04d598b45a9.html,El Mundo,2026-03-05 21:56:12
"Contra la pitada a Scariolo, otra victoria del Real Madrid",https://www.elmundo.es/deportes/baloncesto/euroliga/2026/03/05/69a9da9ae85ece55658b4577.html,El Mundo,2026-03-05 21:54:38
24 aviones de combate salieron de España para atacar Irán mientras Sánchez presumía del 'No a la guerra',https://www.elmundo.es/espana/2026/03/05/69a9cf65e85ecec5298b458e.html,El Mundo,2026-03-05 21:53:00
España gira hacia la guerra con una joya de la Armada: Sánchez no quiso desairar a Macron y Robles cambió de opinión en minutos,https://www.elmundo.es/espana/2026/03/05/69a9d02021efa079578b4591.html,El Mundo,2026-03-05 21:50:43
Sánchez activa la polarización masiva: los votantes del PSOE se vuelcan en la guerra y prefieren China a EEUU,https://www.elmundo.es/espana/2026/03/05/69a9d06021efa0590f8b4576.html,El Mundo,2026-03-05 21:49:25
Sánchez activa la polarización masiva: los votantes del PSOE se vuelcan en contra de la guerra y prefieren China a EEUU,https://www.elmundo.es/espana/2026/03/05/69a9d06021efa0590f8b4576.html,El Mundo,2026-03-05 21:49:25
"En las entrañas de los refugios subterráneos de Tel Aviv lejos de los misiles de Irán: ""Estamos preparados para todo""",https://www.elmundo.es/internacional/2026/03/05/69a9d306e9cf4a0d7c8b458d.html,El Mundo,2026-03-05 21:47:53
¿Se encamina el mundo hacia una nueva 'guerra de los petroleros' como en los años 80?,https://www.elmundo.es/internacional/2026/03/05/69a9d703e9cf4aa55f8b4573.html,El Mundo,2026-03-05 21:47:33
Buques cargados de gas para Europa se desvían hacia Asia en busca del mejor postor,https://www.elmundo.es/economia/empresas/2026/03/05/69a98a7e21efa04d598b4596.html,El Mundo,2026-03-05 21:47:11
Buques cargados de gas para Europa se desvían ya hacia Asia en busca del mejor postor,https://www.elmundo.es/economia/empresas/2026/03/05/69a98a7e21efa04d598b4596.html,El Mundo,2026-03-05 21:47:11
El récord Guinness del mitinero Abascal que dispara a Vox: 121 localidades en 109 días de campaña permanente,https://www.elmundo.es/espana/2026/03/05/69a9d1e3fc6c83b5218b4599.html,El Mundo,2026-03-05 21:46:16
"Encuentro entre un 'superdonante' de sangre y quien más la necesita: ""Si estoy vivo es por gente como tú""",https://www.elmundo.es/ciencia-y-salud/salud/2026/03/05/69a9b347e85ece532b8b4571.html,El Mundo,2026-03-05 21:45:49
"Vox no apoyará a Guardiola y el PP se lanza contra Abascal: ""Nunca pensamos que uniría sus votos al partido de Sánchez en contra de un gobierno del PP""",https://www.elmundo.es/espana/extremadura/2026/03/05/69a9d0ab21efa0645f8b4592.html,El Mundo,2026-03-05 21:28:28
"Muere a los 51 años Joaquín Palacín, presidente de Chunta Aragonesista",https://www.elmundo.es/aragon/2026/03/05/69a9eb46e85ecefd0f8b457f.html,El Mundo,2026-03-05 20:46:45
"¡La novia!: Monstruosamente desordenada, monstruosamente feliz, monstruosamente Jessie Buckley (****)",https://www.elmundo.es/cultura/cine/2026/03/05/69a99942e4d4d856778b457d.html,El Mundo,2026-03-05 20:14:42
Fernando Alonso y Aston Martin: ¿cómo evitar el gran ridículo en el arranque del Mundial?,https://www.elmundo.es/deportes/formula-1/2026/03/05/69a98f68fdddff89658b45b2.html,El Mundo,2026-03-05 20:01:13
"La F1 tiembla por sus socios prioritarios del Golfo: dos carreras penden de un hilo, con más de 200 millones de dólares en el aire",https://www.elmundo.es/deportes/formula-1/2026/03/05/69a98fc6fdddff6d128b45b4.html,El Mundo,2026-03-05 19:59:36
"Trump despide a la responsable de Seguridad Nacional, Kristi Noem, tras una cascada de escándalos migratorios y de corrupción",https://www.elmundo.es/internacional/2026/03/05/69a9d275fc6c83bf298b45a0.html,El Mundo,2026-03-05 19:54:37
"Un padre demanda a Google tras acusar a su IA de incitar al suicidio de su hijo: ""No estás eligiendo morir. Estás eligiendo llegar""",https://www.elmundo.es/tecnologia/2026/03/05/69a9d65021efa0534e8b4578.html,El Mundo,2026-03-05 19:36:36
La juez de Adamuz exige a Adif que se abstenga de cualquier mantenimiento en el tramo si no la avisa con 15 días de antelación,https://www.elmundo.es/economia/2026/03/05/69a9d97ce9cf4a6f6d8b458e.html,El Mundo,2026-03-05 19:29:33
Italia acusa a EEUU de violar el Derecho internacional y se alinea con España acerca del uso de sus bases militares,https://www.elmundo.es/internacional/2026/03/05/69a9882be9cf4a03458b457d.html,El Mundo,2026-03-05 19:28:39
Novo Nordisk anuncia una bajada de precios en España de sus fármacos contra la diabetes y obesidad: Ozempic y Wegovy,https://www.elmundo.es/ciencia-y-salud/salud/2026/03/05/69a9b735fc6c83c8488b4598.html,El Mundo,2026-03-05 19:17:18
"De Irán a Ucrania, los drones kamikaze cambian la guerra: así se ha convertido el Shahed en la pieza clave del conflicto híbrido",https://www.elmundo.es/internacional/2026/03/05/69a991dfe9cf4a00728b45a6.html,El Mundo,2026-03-05 19:05:48
"Se enquista la crisis entre Illa y el líder de la patronal: ""Sólo han hablado dos veces por mensaje y sobre la salud del presidente""",https://www.elmundo.es/cataluna/2026/03/05/69a9c04e21efa0b1248b456d.html,El Mundo,2026-03-05 18:46:06
Cientos de miles de personas huyen bajo la amenaza israelí de arrasar parte de Beirut,https://www.elmundo.es/internacional/2026/03/05/69a9ca8e21efa04d598b45a9.html,El Mundo,2026-03-05 18:37:00
Sánchez y Meloni remando a contrapelo,https://www.elmundo.es/espana/2026/03/05/69a9c892e4d4d814348b4598.html,El Mundo,2026-03-05 18:31:43
"Cae un ejemplar de drago de más de 200 años en Los Realejos, Tenerife, por las lluvias y el viento",https://www.elmundo.es/ciencia-y-salud/ciencia/2026/03/05/69a9c8bdfc6c8331278b4586.html,El Mundo,2026-03-05 18:17:49
"Trump quiere escoger el líder de Irán: ""El hijo de Jamenei me resulta inaceptable. Yo tengo que participar en el nombramiento, como con Delcy en Venezuela""",https://www.elmundo.es/internacional/2026/03/05/69a9bb7afc6c8395568b45ac.html,El Mundo,2026-03-05 17:25:32
"Trump retoma los ataques: ""España es una perdedora, son muy hostiles. No son buenos compañeros, y nosotros tampoco vamos a serlo con ellos""",https://www.elmundo.es/internacional/2026/03/05/69a9b5fbe4d4d8b32f8b456d.html,El Mundo,2026-03-05 17:02:07
"Irán pide ""la sangre de Trump"" y amplía sus ataques al Cáucaso",https://www.elmundo.es/internacional/2026/03/05/69a9ad6afc6c833e3f8b459b.html,El Mundo,2026-03-05 16:29:26
El viraje radical de Jordan Díaz: abandona a Iván Pedroso y España para entrenar en EEUU,https://www.elmundo.es/deportes/mas-deporte/2026/03/05/69a9ad7ee4d4d8c0378b45b5.html,El Mundo,2026-03-05 16:28:13
Irán eleva la tensión en el Golfo y ataca un petrolero de Estados Unidos,https://www.elmundo.es/internacional/2026/03/05/69a9508021efa007698b457a.html,El Mundo,2026-03-05 16:27:05
"Italia consigue que la cadena de restaurantes 'La Mafia se sienta a la mesa' tenga que cambiar de nombre, al considerarlo ofensivo",https://www.elmundo.es/economia/empresas/2026/03/05/69a9ac5721efa0494f8b4596.html,El Mundo,2026-03-05 16:22:23
"Estas son las cuentas que te ofrecen hasta un 3,28% TIN en marzo de 2026",https://www.elmundo.es/economia/dinero-inversion/2026/03/05/69a9a645fdddff07098b4590.html,El Mundo,2026-03-05 15:53:54
España envía su mejor fragata a Chipre tras los ataques de Irán,https://www.elmundo.es/espana/2026/03/05/69a944ad21efa001198b4570.html,El Mundo,2026-03-05 15:29:44
