keyword,count_now,count_base,ratio,viral_score,sources,n_sources,sample_title,detected_at
bolsonaro,4,5,9.18,100,"elpais, france24_es, infolibre, levante_emv",4,"Bolsonaro, hospitalizado en cuidados intensivos en Brasilia a causa de una neumonía aguda",2026-03-13 19:33
comprobar,3,0,5.0,100,okdiario,1,"Comprobar Bonoloto: resultado y número premiado hoy, viernes 13 de marzo de 2026",2026-03-13 19:33
viernes,3,6,5.74,100,okdiario,1,"Comprobar Bonoloto: resultado y número premiado hoy, viernes 13 de marzo de 2026",2026-03-13 19:33
junto,3,6,5.74,100,"20minutos, levante_emv, infolibre",3,"Sale a la luz la primera foto de Epstein junto al expríncipe Andrés y el exministro Mandelson, ambos en bata",2026-03-13 19:33
bronconeumonía,3,3,11.48,100,"france24_es, infolibre, levante_emv",3,El expresidente de Brasil Jair Bolsonaro ingresa a cuidados intensivos por bronconeumonía,2026-03-13 19:33
europa,4,15,3.06,61,"google_news_politica, france24_es, 20minutos, okdiario",4,El Govern esperará a las medidas que active España y Europa pero la oposición le exige actuar ya - La Vanguardia,2026-03-13 19:33
marzo,3,13,2.65,52,okdiario,1,"Comprobar Bonoloto: resultado y número premiado hoy, viernes 13 de marzo de 2026",2026-03-13 19:33
