keyword,count_now,count_base,ratio,viral_score,sources,n_sources,sample_title,detected_at
goles,3,1,46.2,100,"okdiario, elpais",2,"Athletic – Barça: cómo va el partido de Liga hoy, resumen, goles y marcador",2026-03-07 22:32
barcelona,3,9,5.13,100,"elpais, levante_emv",2,Athletic - Barcelona en directo | Duelo igualadísimo que continúa sin goles,2026-03-07 22:32
resultados,3,6,7.7,100,"elcorreo, levante_emv",2,La Primitiva acumula ya el mayor bote de su historia: comprobar resultados del 7 de marzo,2026-03-07 22:32
marzo,5,13,5.92,100,"elcorreo, 20minutos, levante_emv",3,La Primitiva acumula ya el mayor bote de su historia: comprobar resultados del 7 de marzo,2026-03-07 22:32
athletic,5,21,3.67,73,"okdiario, elpais, levante_emv, elcorreo",4,"Athletic – Barça: cómo va el partido de Liga hoy, resumen, goles y marcador",2026-03-07 22:32
