keyword,count_now,count_base,ratio,viral_score,sources,n_sources,sample_title,detected_at
galicia,5,0,5.0,100,"google_news_economia, google_news_es, google_news_internacional",3,La guerra le costará 6.800 millones a España y hace peligrar 600.000 empleos - La Voz de Galicia,2026-03-15 05:33
aragón,5,0,5.0,100,heraldo_aragon,1,"La guerra dispara ya un 25,5 % el diésel en Aragón y amenaza su industria y transporte",2026-03-15 05:33
zaragoza,5,2,11.03,100,heraldo_aragon,1,| David Navarro devuelve la vida al Real Zaragoza,2026-03-15 05:33
maestrazgo,3,0,5.0,100,heraldo_aragon,1,El Maestrazgo se juega su futuro con el Caso Forestalia: &quot;Es el mejor lugar para vivir&quot;,2026-03-15 05:33
mundo,3,3,4.41,88,heraldo_aragon,1,El mundo común,2026-03-15 05:33
millones,3,5,2.65,52,"google_news_economia, heraldo_aragon",2,La guerra le costará 6.800 millones a España y hace peligrar 600.000 empleos - La Voz de Galicia,2026-03-15 05:33
