keyword,count_now,count_base,ratio,viral_score,sources,n_sources,sample_title,detected_at
resultados,4,8,7.69,100,"elpais, elcorreo, elespanol",3,"Resultados elecciones legislativas Colombia 2026, en vivo | Paloma Valencia lidera la consulta de la derecha, Claudia López la del centro y Roy Barreras adelanta a Daniel Quintero en la izquierda",2026-03-08 23:02
elige,3,1,46.11,100,"elcorreo, elpais, eldiario",3,"Irán elige como Líder Supremo al hijo de Alí Jamenei, ahora amenazado de muerte",2026-03-08 23:02
líder,14,9,23.91,100,"elcorreo, eldiario, bbc_mundo, heraldo_aragon, huffington_es",5,"Irán elige como Líder Supremo al hijo de Alí Jamenei, ahora amenazado de muerte",2026-03-08 23:02
supremo,13,7,28.54,100,"elcorreo, eldiario, bbc_mundo, heraldo_aragon, huffington_es",5,"Irán elige como Líder Supremo al hijo de Alí Jamenei, ahora amenazado de muerte",2026-03-08 23:02
jamenei,16,2,122.96,100,"elcorreo, eldiario, bbc_mundo, heraldo_aragon, huffington_es",5,"Irán elige como Líder Supremo al hijo de Alí Jamenei, ahora amenazado de muerte",2026-03-08 23:02
mojtaba,11,2,84.54,100,"eldiario, elcorreo, bbc_mundo, heraldo_aragon, huffington_es",5,"Quién es Mojtaba Jamenei, el nuevo líder supremo de Irán",2026-03-08 23:02
nuevo,8,15,8.2,100,"eldiario, bbc_mundo, heraldo_aragon, okdiario, 20minutos",5,"Quién es Mojtaba Jamenei, el nuevo líder supremo de Irán",2026-03-08 23:02
elegido,3,3,15.37,100,"elcorreo, heraldo_aragon, europapress",3,"Última hora de la Guerra en Oriente Medio: Mojtaba Jamenei, elegido como líder supremo de la República Islámica",2026-03-08 23:02
nombra,3,0,5.0,100,"huffington_es, 20minutos, france24_es, elpais",4,Irán nombra líder supremo a Mojtaba Jamenei tras la muerte de su padre en los bombardeos de EEUU e Israel,2026-03-08 23:02
