keyword,count_now,count_base,ratio,viral_score,sources,n_sources,sample_title,detected_at
fallas,3,0,5.0,100,"okdiario, levante_emv",2,¿Cuánto dinero se llevan los ganadores de las Fallas de Valencia 2026?,2026-03-15 06:33
contra,3,2,7.34,100,"levante_emv, infolibre",2,Sanidad activa un segundo equipo nuevo contra el cáncer de mama dos años y medio después de recibirlo,2026-03-15 06:33
amazon,3,0,5.0,100,"lavanguardia, google_news_es, elpais",3,Mejores chollos de hoy domingo de la Fiesta de Ofertas de Primavera de Amazon,2026-03-15 06:33
puente,3,0,5.0,100,google_news_internacional,1,Aniversario del Puente Internacional de Tui: 140 años de una joya arquitectónica que cambió para siempre la 'raia' - Faro de Vigo,2026-03-15 06:33
petróleo,3,1,14.69,100,"infolibre, elpais",2,Un imperio maldito por el petróleo: por qué el odio a EEUU hace imposible que los iraníes apoyen a Trump,2026-03-15 06:33
gobierno,3,1,14.69,100,okdiario,1,El Gobierno niega vuelos de Begoña y su asesora pero viajaron juntas por España para promocionar la cátedra,2026-03-15 06:33
trabajo,3,2,7.34,100,"google_news_es, elpais, okdiario",3,"Jonathan Brill, ‘futurólogo’ de Amazon: “La IA hará el 80% de nuestro trabajo en los próximos años” - EL PAÍS",2026-03-15 06:33
domingo,3,3,4.9,97,"okdiario, lavanguardia",2,"Horóscopo diario gratis: la predicción para hoy, domingo 15 de marzo",2026-03-15 06:33
marzo,3,7,2.1,41,okdiario,1,"Horóscopo diario gratis: la predicción para hoy, domingo 15 de marzo",2026-03-15 06:33
