keyword,count_now,count_base,ratio,viral_score,sources,n_sources,sample_title,detected_at
final,3,3,15.88,100,"elcorreo, okdiario, huffington_es",3,Largo y tortuoso camino hasta el final,2026-03-12 23:33
madrid,3,9,5.29,100,"elpais, elmundo, elespanol",3,El Real Madrid impone ante el Valencia la ley del más fuerte,2026-03-12 23:33
mundo,3,5,9.53,100,"elpais, bbc_mundo, okdiario",3,"Duplantis bate su decimoquinto récord del mundo e inicia la escalada hacia los 6,40m",2026-03-12 23:33
valencia,3,10,4.76,95,"elpais, elmundo, elespanol",3,El Real Madrid impone ante el Valencia la ley del más fuerte,2026-03-12 23:33
ataque,3,12,3.97,79,"elpais, 20minutos",2,"Última hora del ataque de EE UU e Israel contra Irán, en directo | Una coalición internacional liderada por EE UU podrá escoltar buques petroleros por el estrecho de Ormuz",2026-03-12 23:33
última,3,13,3.66,73,"elpais, levante_emv",2,"Última hora del ataque de EE UU e Israel contra Irán, en directo | Una coalición internacional liderada por EE UU podrá escoltar buques petroleros por el estrecho de Ormuz",2026-03-12 23:33
