keyword,count_now,count_base,ratio,viral_score,sources,n_sources,sample_title,detected_at
resultados,5,3,14.03,100,"okdiario, elespanol, google_news_es",3,"Resultados de las elecciones autonómicas de Castilla y León 2026 en directo | Escrutinio, sondeos y ganador",2026-03-15 20:04
lasexta,3,1,25.26,100,"google_news_internacional, google_news_es",2,"Joaquim Bosch ve ""bastante improbable"" una sanción jurídica internacional a Trump por sus acciones en Irán - LaSexta",2026-03-15 20:04
votación,3,1,25.26,100,"lavanguardia, eldiario",2,Elecciones en Castilla y León: los colegios viven los últimos minutos de la votación con todo por definir,2026-03-15 20:04
petróleo,3,5,5.05,100,"elmundo, elpais, elcorreo",3,"La AIE anuncia la liberación ""inmediata"" de las primeras reservas de petróleo para frenar la escalada de precios ante la guerra en Oriente Próximo",2026-03-15 20:04
próximo,4,3,11.23,100,"elmundo, elpais, google_news_es, elpais_internacional",4,"La AIE anuncia la liberación ""inmediata"" de las primeras reservas de petróleo para frenar la escalada de precios ante la guerra en Oriente Próximo",2026-03-15 20:04
flick,3,0,5.0,100,"lavanguardia, okdiario",2,"Elecciones en el Barcelona: Flick, Raphinha, Fermín, Olmo o Pedri votan tras el partido",2026-03-15 20:04
oriente,4,7,4.81,96,"elmundo, elpais, google_news_es, elpais_internacional",4,"La AIE anuncia la liberación ""inmediata"" de las primeras reservas de petróleo para frenar la escalada de precios ante la guerra en Oriente Próximo",2026-03-15 20:04
semana,3,7,3.61,72,"google_news_internacional, elpais, google_news_es",3,Segundo equipo suspendido por dopaje en una semana - Ciclismo Internacional,2026-03-15 20:04
elecciones,10,35,2.41,48,"okdiario, elespanol, lavanguardia",3,"Resultados de las elecciones autonómicas de Castilla y León 2026 en directo | Escrutinio, sondeos y ganador",2026-03-15 20:04
