keyword,count_now,count_base,ratio,viral_score,sources,n_sources,sample_title,detected_at
mujer,3,9,5.11,100,"20minutos, levante_emv, france24_es, heraldo_aragon, elcorreo",5,Identifican a la mujer que disparó contra la mansión de Rihanna: le acusan de intento de asesinato,2026-03-09 21:02
abascal,3,7,6.57,100,"levante_emv, okdiario",2,Abascal llama desde Béjar a apostar por “el patriotismo y el sentido común” de VOX frente a la mafia del PSOE y la estafa del PP,2026-03-09 21:02
partido,3,9,5.11,100,"okdiario, elcorreo, eldiario",3,A qué hora es Carlos Alcaraz – Rinderknech: cuándo es y dónde ver por TV en directo el partido de Indian Wells 2026,2026-03-09 21:02
mujeres,3,7,6.57,100,"levante_emv, france24_es, elcorreo",3,"Violeta Salama ('Auri'): ""No es justa la idea según la que parece que las mujeres nos movemos mejor en las películas pequeñas""",2026-03-09 21:02
israel,5,17,4.51,90,"france24_es, infolibre, elpais, huffington_es",4,"Mojtaba Jamenei, el nuevo líder de Irán blanco de EE. UU. e Israel",2026-03-09 21:02
trump,5,24,3.19,63,"okdiario, eldiario, elcorreo, elpais",4,"Las bolsas de EEUU suben un 1,5% tras anuncar Trump que el fin de la guerra está cerca",2026-03-09 21:02
medio,3,16,2.87,57,"elcorreo, huffington_es, heraldo_aragon",3,Última hora de la Guerra en Oriente Medio: Trump considera que la guerra en Irán está «prácticamente terminada»,2026-03-09 21:02
guerra,9,51,2.7,54,"okdiario, eldiario, elcorreo, infolibre, elpais",5,"Las bolsas de EEUU suben un 1,5% tras anuncar Trump que el fin de la guerra está cerca",2026-03-09 21:02
