keyword,count_now,count_base,ratio,viral_score,sources,n_sources,sample_title,detected_at
futuro,3,2,12.52,100,"elcorreo, europapress, levante_emv",3,Última hora de la Guerra en Oriente Medio: Trump avisa al futuro líder de Irán que «no durará mucho» si no cuenta con el apoyo de EE UU,2026-03-08 18:02
durará,4,0,5.0,100,"elcorreo, huffington_es, okdiario, europapress",4,Última hora de la Guerra en Oriente Medio: Trump avisa al futuro líder de Irán que «no durará mucho» si no cuenta con el apoyo de EE UU,2026-03-08 18:02
advierte,3,4,6.26,100,"huffington_es, 20minutos, okdiario",3,Trump advierte que el nuevo líder supremo de Irán &quot;no durará mucho&quot; sin la aprobación de EEUU,2026-03-08 18:02
teherán,3,2,12.52,100,"huffington_es, heraldo_aragon, france24_es",3,Israel lanza nuevos bombardeos &quot;a gran escala&quot; en Teherán tras atacar más de 400 objetivos en Irán,2026-03-08 18:02
trump,5,11,3.79,75,"elcorreo, huffington_es, okdiario, europapress, levante_emv",5,Última hora de la Guerra en Oriente Medio: Trump avisa al futuro líder de Irán que «no durará mucho» si no cuenta con el apoyo de EE UU,2026-03-08 18:02
muere,3,8,3.13,62,"levante_emv, okdiario, google_news_es",3,"Muere David Morales, exmilitar jerezano acusado de espiar a Julian Assange, fundador de Wikileaks",2026-03-08 18:02
líder,4,14,2.38,47,"elcorreo, huffington_es, okdiario, europapress",4,Última hora de la Guerra en Oriente Medio: Trump avisa al futuro líder de Irán que «no durará mucho» si no cuenta con el apoyo de EE UU,2026-03-08 18:02
