keyword,count_now,count_base,ratio,viral_score,sources,n_sources,sample_title,detected_at
valverde,5,9,13.44,100,"levante_emv, elpais, elespanol, google_news_es, elcorreo",5,Valverde se disfraza de Mbappé para golear al City de Guardiola,2026-03-11 23:03
madrid,9,36,6.05,100,"elpais, huffington_es, elespanol, elcorreo, google_news_es",5,"Real Madrid - Manchester City, en directo | Un triplete de Valverde da ventaja al Madrid en la eliminatoria ante el City",2026-03-11 23:03
manchester,6,15,9.68,100,"elpais, huffington_es, elespanol, google_news_es, levante_emv",5,"Real Madrid - Manchester City, en directo | Un triplete de Valverde da ventaja al Madrid en la eliminatoria ante el City",2026-03-11 23:03
champions,3,14,5.19,100,"huffington_es, google_news_es, levante_emv",3,"El Real Madrid renace, sorprende y vence al Manchester City 3-0 en los octavos de final de Champions League",2026-03-11 23:03
miranda,4,10,9.68,100,"elmundo_espana, elcorreo",2,"La semana criminal del asesino de Miranda: acababa de salir de prisión, pasó la tarde previa bebiendo y no soportaba el rechazo de su pareja",2026-03-11 23:03
