keyword,count_now,count_base,ratio,viral_score,sources,n_sources,sample_title,detected_at
athletic,3,3,7.21,100,"okdiario, elcorreo",2,"Athletic Club – Barcelona, en directo: Alineaciones y dónde ver el partido de  La Liga hoy",2026-03-07 20:02
gobierno,3,4,5.41,100,"okdiario, 20minutos, levante_emv",3,Trump reconoce oficialmente al Gobierno de Venezuela: «Hemos alcanzado un acuerdo sobre el oro»,2026-03-07 20:02
ucrania,3,4,5.41,100,elpais,1,Ucrania - España en directo | Ovdiychuk marca para Ucrania y recorta la distancia,2026-03-07 20:02
lópez,4,2,14.42,100,"okdiario, google_news_politica, levante_emv, elpais",4,El ministro Óscar López que tapó la juerga de Ábalos en el Parador de Teruel califica de «machista» a Ayuso,2026-03-07 20:02
escalada,3,2,10.82,100,"huffington_es, elpais, france24_es",3,"Irán amenaza con nuevos ataques tras el aviso de Trump: &quot;Si busca la escalada, es lo que tendrá&quot;",2026-03-07 20:02
semana,3,4,5.41,100,"elcorreo, levante_emv, heraldo_aragon",3,Una semana de la guerra «que podría salirse de control»,2026-03-07 20:02
directo,6,19,2.28,45,"okdiario, elcorreo, elpais, france24_es",4,"Athletic Club – Barcelona, en directo: Alineaciones y dónde ver el partido de  La Liga hoy",2026-03-07 20:02
