keyword,count_now,count_base,ratio,viral_score,sources,n_sources,sample_title,detected_at
euros,4,5,16.12,100,"elcorreo, huffington_es, 20minutos",3,La Primitiva del jueves reparte nueve pellizcos y su histórico bote alcanza los 124 millones de euros: resultados del 12 de marzo,2026-03-12 23:03
madrid,3,9,6.72,100,"elmundo, elespanol, heraldo_aragon",3,El Madrid se desmelena y castiga duramente al Valencia con su propia medicina,2026-03-12 23:03
mundo,3,7,8.63,100,"elpais, bbc_mundo, okdiario",3,"Duplantis bate su decimoquinto récord del mundo e inicia la escalada hacia los 6,40m",2026-03-12 23:03
castilla,3,10,6.04,100,okdiario,1,"LA ANTORCHA | Abascal arrasa en Castilla y León, Mañueco gana y Sánchez aguanta",2026-03-12 23:03
reflexión,3,0,5.0,100,"huffington_es, okdiario",2,La importante reflexión de Sole Giménez sobre las dificultades de la mujer en una carrera artística: &quot;La industria lo sabe&quot;,2026-03-12 23:03
